Madison Chadwick,Cardiff,Wales,4,"Panasonic Receipt Printer, Durable",0.0,484,213,4,3,148,2015,0,152,2015
Lara Stoate,Grevenbroich,North Rhine-Westphalia,5,"Boston Pencil Sharpener, Easy-Erase",0.0,181,29,6,3,148,2015,1,153,2015
Lara Stoate,Grevenbroich,North Rhine-Westphalia,5,"Tenex Shelving, Wire Frame",9.7,97,2,2,3,148,2015,1,153,2015
Lara Stoate,Grevenbroich,North Rhine-Westphalia,5,"Cisco Signal Booster, with Caller ID",0.0,1063,266,7,3,148,2015,1,153,2015
Rory Gunson,Leipzig,Saxony,4,"Bevis Wood Table, Rectangular",604.1,1726,-478,5,4,149,2015,1,153,2015
Rory Gunson,Leipzig,Saxony,4,"Binney & Smith Canvas, Blue",0.0,154,29,3,4,149,2015,1,153,2015
Rory Gunson,Leipzig,Saxony,4,"Cardinal 3-Hole Punch, Durable",0.0,61,28,2,4,149,2015,1,153,2015
Rory Gunson,Leipzig,Saxony,4,"Canon Fax and Copier, Color",0.0,578,139,3,4,149,2015,1,153,2015
Rory Gunson,Leipzig,Saxony,4,"Hewlett Wireless Fax, Digital",0.0,1899,228,5,4,149,2015,1,153,2015
Ebony Northcott,Eastbourne,England,4,"Office Star Chairmat, Adjustable",0.0,205,80,3,4,149,2015,1,153,2015
Abbie Perry,Milan,Lombardy,3,"Kraft Interoffice Envelope, Recycled",0.0,229,75,5,4,149,2015,0,152,2015
Jared Wurster,Faenza,Emilia-Romagna,4,"Brother Personal Copier, Digital",0.0,143,3,1,4,149,2015,1,153,2015
Jeremy Pilcher,Stockholm,Stockholm,0,"Stanley Sketch Pad, Easy-Erase",56.0,112,-69,5,4,149,2015,4,149,2015
Jeremy Pilcher,Stockholm,Stockholm,0,"Wilson Jones Binder Covers, Recycled",6.0,12,-6,2,4,149,2015,4,149,2015
Matthew Gill,Pontault-Combault,Ile-de-France,4,"Boston Highlighters, Fluorescent",0.0,60,16,3,5,150,2015,2,154,2015
Matthew Gill,Pontault-Combault,Ile-de-France,4,"Tenex Box, Blue",4.5,45,7,3,5,150,2015,2,154,2015
Spencer Akhtar,Amersfoort,Utrecht,7,"Canon Copy Machine, Digital",196.5,393,-306,3,5,150,2015,5,157,2015
Ashton Morey,Lyon,Auvergne-Rhône-Alpes,6,"Wilson Jones 3-Hole Punch, Durable",0.0,147,31,5,6,151,2015,5,157,2015
Owen Howell,Offenburg,Baden-Württemberg,3,"BIC Canvas, Blue",0.0,269,21,5,6,151,2015,2,154,2015
Owen Howell,Offenburg,Baden-Württemberg,3,"Boston Sketch Pad, Blue",0.0,194,84,4,6,151,2015,2,154,2015
Owen Howell,Offenburg,Baden-Württemberg,3,"Memorex Mouse, Bluetooth",0.0,85,3,3,6,151,2015,2,154,2015
Owen Howell,Offenburg,Baden-Württemberg,3,"Cisco Headset, Full Size",0.0,628,213,7,6,151,2015,2,154,2015
Beverly Brooks,Barcelona,Catalonia,3,"Boston Canvas, Fluorescent",0.0,165,30,3,6,151,2015,2,154,2015
Beverly Brooks,Barcelona,Catalonia,3,"Avery Index Tab, Durable",0.0,20,5,3,6,151,2015,2,154,2015
Brodie Hart,Vienna,Vienna,6,"HP Wireless Fax, Color",0.0,1085,11,3,6,151,2015,5,157,2015
Isabella Cleary,Menton,Provence-Alpes-Côte d'Azur,5,"Sanford Pencil Sharpener, Fluorescent",0.0,207,72,8,6,151,2015,4,156,2015
Ashton Morey,Trier,Rhineland-Palatinate,5,"Bush 3-Shelf Cabinet, Traditional",12.9,129,17,1,6,151,2015,4,156,2015
Ashton Morey,Trier,Rhineland-Palatinate,5,"Novimex Color Coded Labels, Adjustable",0.0,10,5,1,6,151,2015,4,156,2015
Ashton Morey,Trier,Rhineland-Palatinate,5,"Smead Legal Exhibit Labels, Adjustable",0.0,9,1,1,6,151,2015,4,156,2015
Ashton Morey,Trier,Rhineland-Palatinate,5,"Xerox Parchment Paper, Premium",0.0,40,13,3,6,151,2015,4,156,2015
Ashton Morey,Trier,Rhineland-Palatinate,5,"Tenex Trays, Wire Frame",24.0,240,107,5,6,151,2015,4,156,2015
Ashton Morey,Trier,Rhineland-Palatinate,5,"Motorola Smart Phone, Full Size",0.0,2571,977,4,6,151,2015,4,156,2015
Leah Norman,Albacete,Castile-La Mancha,4,"Tenex Folders, Blue",8.4,84,21,4,0,152,2015,4,156,2015
Harvey Drozd,Copenhagen,Hovedstaden,6,"Novimex Executive Leather Armchair, Red",460.0,920,-276,4,0,152,2015,6,158,2015
Harvey Drozd,Copenhagen,Hovedstaden,6,"GlobeWeis Business Envelopes, Set of 50",13.0,26,-12,3,0,152,2015,6,158,2015
Harvey Drozd,Copenhagen,Hovedstaden,6,"Smead Box, Blue",8.0,16,-16,3,0,152,2015,6,158,2015
Harvey Drozd,Copenhagen,Hovedstaden,6,"Belkin Keyboard, Programmable",149.5,299,-197,7,0,152,2015,6,158,2015
Leah Norman,London,England,6,"Cardinal Binding Machine, Economy",17.9,179,36,4,1,153,2015,0,159,2015
Leah Norman,London,England,6,"Ibico 3-Hole Punch, Recycled",5.5,55,11,2,1,153,2015,0,159,2015
Leah Norman,London,England,6,"Eldon Folders, Industrial",7.9,79,-6,5,1,153,2015,0,159,2015
Leah Norman,London,England,6,"Nokia Signal Booster, VoIP",73.8,738,147,6,1,153,2015,0,159,2015
William Horton,Porto,Porto,4,"SanDisk Parchment Paper, Multicolor",27.0,54,-33,6,1,153,2015,5,157,2015
William Horton,Porto,Porto,4,"Fiskars Scissors, Easy Grip",37.0,74,-57,6,1,153,2015,5,157,2015
Logan Tilley,Hamburg,Hamburg,4,"GlobeWeis Peel and Seal, with clear poly window",0.0,75,4,3,2,154,2015,6,158,2015
Logan Tilley,Hamburg,Hamburg,4,"Cisco Office Telephone, Full Size",0.0,409,78,5,2,154,2015,6,158,2015
Josh Wilkinson,Echirolles,Auvergne-Rhône-Alpes,4,"Binney & Smith Pencil Sharpener, Water Color",0.0,135,62,5,2,154,2015,6,158,2015
Michael Kim,Dortmund,North Rhine-Westphalia,6,"Ames Peel and Seal, Recycled",0.0,52,18,3,2,154,2015,1,160,2015
Michael Kim,Dortmund,North Rhine-Westphalia,6,"Canon Fax Machine, Digital",0.0,636,146,2,2,154,2015,1,160,2015
Cerys Edwards,Berlin,Berlin,3,"Accos Rubber Bands, Metal",1.5,15,5,1,2,154,2015,5,157,2015
Cerys Edwards,Berlin,Berlin,3,"Eldon Trays, Single Width",15.4,77,12,2,2,154,2015,5,157,2015
Lori Miller,Cartagena,Murcia,3,"Eldon Photo Frame, Duo Pack",0.0,116,7,2,3,155,2015,6,158,2015
Christopher Goold,London,England,4,"StarTech Card Printer, White",43.7,437,29,3,3,155,2015,0,159,2015
Michael Flores,Milan,Lombardy,3,"Breville Refrigerator, Black",0.0,2594,1141,5,3,155,2015,6,158,2015
Michael Flores,Milan,Lombardy,3,"Avery Binding Machine, Economy",0.0,342,41,7,3,155,2015,6,158,2015
Judith Franke,Altamura,Apulia,6,"Cameo Mailers, Recycled",0.0,259,59,7,3,155,2015,2,161,2015
Hannah Conyers,Waterlooville,England,5,"Eaton Memo Slips, Multicolor",0.0,106,18,7,3,155,2015,1,160,2015
Max Ludwig,Clichy-sous-Bois,Ile-de-France,4,"HP Wireless Fax, Digital",412.95,2753,842,9,4,156,2015,1,160,2015
Georgia Bermingham,Dorsten,North Rhine-Westphalia,2,"Deflect-O Door Stop, Durable",0.0,123,17,3,4,156,2015,6,158,2015
Georgia Bermingham,Dorsten,North Rhine-Westphalia,2,"Boston Pencil Sharpener, Water Color",0.0,193,96,6,4,156,2015,6,158,2015
Jason Martinez,Magdeburg,Saxony-Anhalt,3,"BIC Markers, Fluorescent",0.0,166,13,6,4,156,2015,0,159,2015
Jason Martinez,Magdeburg,Saxony-Anhalt,3,"BIC Pens, Easy-Erase",0.0,15,3,1,4,156,2015,0,159,2015
Kaitlyn Dorsch,Gothenburg,Västra Götaland,4,"Harbour Creations Bag Chairs, Adjustable",48.0,96,-8,3,4,156,2015,1,160,2015
Kaitlyn Dorsch,Gothenburg,Västra Götaland,4,"Advantus Light Bulb, Black",14.4,24,-8,3,4,156,2015,1,160,2015
Kaitlyn Dorsch,Gothenburg,Västra Götaland,4,"Avery Binding Machine, Durable",50.5,101,-89,4,4,156,2015,1,160,2015
Kaitlyn Dorsch,Gothenburg,Västra Götaland,4,"Cameo Peel and Seal, Recycled",15.0,30,-16,3,4,156,2015,1,160,2015
Kaitlyn Dorsch,Gothenburg,Västra Götaland,4,"Enermax Memory Card, Erganomic",112.0,224,-14,4,4,156,2015,1,160,2015
Kaitlyn Dorsch,Gothenburg,Västra Götaland,4,"Motorola Office Telephone, VoIP",54.0,108,-13,3,4,156,2015,1,160,2015
Isla Vogel,Paris,Ile-de-France,6,"Okidata Card Printer, Durable",89.7,598,-49,4,4,156,2015,3,162,2015
Joan Douglas,Bergen,Hordaland,4,"Kraft Peel and Seal, Security-Tint",0.0,69,11,3,4,156,2015,1,160,2015
Joan Douglas,Bergen,Hordaland,4,"Enermax Memory Card, Programmable",0.0,348,66,3,4,156,2015,1,160,2015
Joan Douglas,Bergen,Hordaland,4,"Epson Inkjet, Durable",0.0,1533,506,5,4,156,2015,1,160,2015
George To Rot,Valladolid,Castile and León,3,"Wilson Jones Binding Machine, Durable",0.0,50,1,1,4,156,2015,0,159,2015
George To Rot,Valladolid,Castile and León,3,"Xerox Note Cards, Multicolor",0.0,83,21,3,4,156,2015,0,159,2015
George To Rot,Valladolid,Castile and León,3,"Rogers Shelving, Single Width",44.8,448,-10,8,4,156,2015,0,159,2015
George To Rot,Valladolid,Castile and León,3,"Samsung Smart Phone, VoIP",572.6,5726,-445,10,4,156,2015,0,159,2015
Bianca Crisp,Tilburg,North Brabant,4,"Advantus Light Bulb, Erganomic",9.0,45,-6,3,4,156,2015,1,160,2015
Bianca Crisp,Tilburg,North Brabant,4,"Tenex Light Bulb, Black",6.0,30,4,2,4,156,2015,1,160,2015
Bianca Crisp,Tilburg,North Brabant,4,"Ibico Binding Machine, Recycled",129.5,259,-166,10,4,156,2015,1,160,2015
Holly Black,Hamburg,Hamburg,4,"Sanford Markers, Fluorescent",0.0,98,39,4,5,157,2015,2,161,2015
Christopher Goold,Fano,Marche,5,"Boston Pens, Water Color",0.0,52,5,3,5,157,2015,3,162,2015
Poppy McWilliams,Vienna,Vienna,6,"Cuisinart Blender, White",0.0,261,99,4,5,157,2015,4,163,2015
Poppy McWilliams,Vienna,Vienna,6,"Okidata Receipt Printer, Durable",0.0,615,25,5,5,157,2015,4,163,2015
Brodie Hart,Heerlen,Limburg,4,"Dania 3-Shelf Cabinet, Pine",35.5,71,-59,1,5,157,2015,2,161,2015
Brodie Hart,Heerlen,Limburg,4,"Xerox Note Cards, Recycled",19.5,39,-24,3,5,157,2015,2,161,2015
Jonathan Bottrill,Bourges,Centre-Val de Loire,4,"Avery 3-Hole Punch, Recycled",0.0,85,0,3,6,158,2015,3,162,2015
Scott Higgins,Monza,Lombardy,2,"Elite Letter Opener, High Speed",0.0,53,22,2,6,158,2015,1,160,2015
Evan Allen,Seville,Andalusía,5,"Hon Executive Leather Armchair, Red",147.0,735,-184,2,6,158,2015,4,163,2015
Holly Noble,Turin,Piedmont,4,"Elite Scissors, Easy Grip",0.0,24,11,1,0,159,2015,4,163,2015
Timothy Jimenez,Norwich,England,3,"Ibico Binder, Clear",0.0,45,4,3,0,159,2015,3,162,2015
Indiana Wekey,Montauban,Languedoc-Roussillon-Midi-Pyrénées,1,"Stanley Markers, Easy-Erase",0.0,45,0,2,0,159,2015,1,160,2015
Indiana Wekey,Montauban,Languedoc-Roussillon-Midi-Pyrénées,1,"GlobeWeis Clasp Envelope, with clear poly window",0.0,13,5,1,0,159,2015,1,160,2015
Indiana Wekey,Montauban,Languedoc-Roussillon-Midi-Pyrénées,1,"Fiskars Ruler, High Speed",0.0,29,0,2,0,159,2015,1,160,2015
Louise Walsh,Roanne,Auvergne-Rhône-Alpes,4,"BIC Pencil Sharpener, Fluorescent",0.0,212,72,7,0,159,2015,4,163,2015
Louise Walsh,Roanne,Auvergne-Rhône-Alpes,4,"Binney & Smith Markers, Fluorescent",0.0,76,21,3,0,159,2015,4,163,2015
Louise Walsh,Roanne,Auvergne-Rhône-Alpes,4,"Logitech Numeric Keypad, Bluetooth",0.0,278,42,6,0,159,2015,4,163,2015
Erin Gill,Bordeaux,Aquitaine-Limousin-Poitou-Charentes,4,"Eldon Trays, Blue",17.3,173,15,4,0,159,2015,4,163,2015
Anna Moreton,Toledo,Castile-La Mancha,6,"Enermax Note Cards, Multicolor",0.0,98,21,3,0,159,2015,6,165,2015
Nathan Allwood,Nice,Provence-Alpes-Côte d'Azur,4,"Green Bar Note Cards, Multicolor",0.0,34,14,1,1,160,2015,5,164,2015
Dustin Thomas,Bayonne,Aquitaine-Limousin-Poitou-Charentes,5,"Eldon Door Stop, Black",0.0,602,114,12,1,160,2015,6,165,2015
Dustin Thomas,Bayonne,Aquitaine-Limousin-Poitou-Charentes,5,"Boston Sketch Pad, Fluorescent",0.0,648,0,13,1,160,2015,6,165,2015
Dustin Thomas,Bayonne,Aquitaine-Limousin-Poitou-Charentes,5,"Cardinal Binder Covers, Clear",0.0,34,9,3,1,160,2015,6,165,2015
Dustin Thomas,Bayonne,Aquitaine-Limousin-Poitou-Charentes,5,"Apple Speaker Phone, with Caller ID",110.1,734,86,7,1,160,2015,6,165,2015
Madison Chadwick,Marseille,Provence-Alpes-Côte d'Azur,1,"Bevis Training Table, Adjustable Height",383.6,1096,-422,5,1,160,2015,2,161,2015
Jay Andrews,Paris,Ile-de-France,6,"Harbour Creations Steel Folding Chair, Red",26.4,264,50,3,2,161,2015,1,167,2015
Jay Andrews,Paris,Ile-de-France,6,"Tenex Light Bulb, Erganomic",0.0,18,1,1,2,161,2015,1,167,2015
Jay Andrews,Paris,Ile-de-France,6,"GlobeWeis Peel and Seal, Set of 50",0.0,43,0,2,2,161,2015,1,167,2015
Eileen Walker,Dresden,Saxony,4,"Binney & Smith Pens, Easy-Erase",12.0,24,-24,4,3,162,2015,0,166,2015
Evie Flockhart,Edinburgh,Scotland,2,"Novimex Chairmat, Red",0.0,225,68,4,3,162,2015,5,164,2015
Evie Flockhart,Edinburgh,Scotland,2,"Avery Legal Exhibit Labels, Laser Printer Compatible",0.0,11,2,1,3,162,2015,5,164,2015
Jade Hawkins,Carvin,Nord-Pas-de-Calais-Picardie,4,"Binney & Smith Sketch Pad, Easy-Erase",0.0,186,28,4,3,162,2015,0,166,2015
Robert Neil,Manchester,England,4,"Hewlett Copy Machine, Laser",0.0,1580,32,6,3,162,2015,0,166,2015
Mike Obrien,Rome,Lazio,7,"Boston Pens, Fluorescent",0.0,31,5,2,3,162,2015,3,169,2015
Mike Obrien,Rome,Lazio,7,"Canon Fax Machine, Digital",0.0,954,219,3,3,162,2015,3,169,2015
Ramona Hohl,Madrid,Madrid,1,"Sanford Markers, Water Color",0.0,370,33,14,3,162,2015,4,163,2015
Ada Dalton,Unna,North Rhine-Westphalia,7,"Xerox Message Books, Recycled",0.0,61,19,3,3,162,2015,3,169,2015
Melody Nelson,Lisbon,Lisboa,4,"Hoover Stove, White",1700.0,3400,-3060,12,3,162,2015,0,166,2015
Edward Dolling,Barnsley,England,4,"Deflect-O Frame, Black",69.3,231,46,3,4,163,2015,1,167,2015
Edward Dolling,Barnsley,England,4,"Binney & Smith Markers, Fluorescent",0.0,127,34,5,4,163,2015,1,167,2015
Edward Dolling,Barnsley,England,4,"Acco Hole Reinforcements, Clear",0.0,12,0,2,4,163,2015,1,167,2015
Edward Dolling,Barnsley,England,4,"Green Bar Parchment Paper, 8.5 x 11",0.0,104,43,5,4,163,2015,1,167,2015
Walter Aguilar,Villeneuve-Saint-Georges,Ile-de-France,4,"Nokia Smart Phone, Cordless",243.3,1622,324,3,4,163,2015,1,167,2015
Dylan O'Halloran,Seville,Andalusía,2,"Harbour Creations File Folder Labels, Laser Printer Compatible",0.0,70,22,8,4,163,2015,6,165,2015
Madeleine Nixon,Toulon,Provence-Alpes-Côte d'Azur,7,"Avery Binder Covers, Clear",0.0,63,14,6,4,163,2015,4,170,2015
Zoe Lowin,Albi,Languedoc-Roussillon-Midi-Pyrénées,7,"Deflect-O Frame, Durable",0.0,214,88,2,5,164,2015,5,171,2015
Zoe Lowin,Albi,Languedoc-Roussillon-Midi-Pyrénées,7,"BIC Markers, Blue",0.0,132,3,5,5,164,2015,5,171,2015
Zoe Lowin,Albi,Languedoc-Roussillon-Midi-Pyrénées,7,"Boston Markers, Blue",0.0,79,32,3,5,164,2015,5,171,2015
Corey Browne,Utrecht,Utrecht,3,"Hon Bag Chairs, Set of Two",35.5,71,-54,3,5,164,2015,1,167,2015
Corey Browne,Utrecht,Utrecht,3,"Avery 3-Hole Punch, Durable",44.0,88,-27,6,5,164,2015,1,167,2015
Corey Browne,Utrecht,Utrecht,3,"Wilson Jones Binding Machine, Durable",63.0,126,-121,5,5,164,2015,1,167,2015
Corey Browne,Utrecht,Utrecht,3,"GlobeWeis Manila Envelope, Set of 50",13.5,27,-9,2,5,164,2015,1,167,2015
Corey Browne,Utrecht,Utrecht,3,"Konica Card Printer, Wireless",306.5,613,-343,7,5,164,2015,1,167,2015
Mark Harris,Munich,Bavaria,5,"Eldon Light Bulb, Black",0.0,50,19,2,5,164,2015,3,169,2015
Mark Harris,Munich,Bavaria,5,"Sanford Markers, Blue",0.0,93,18,4,5,164,2015,3,169,2015
Mark Harris,Munich,Bavaria,5,"Ames Interoffice Envelope, Recycled",0.0,132,59,3,5,164,2015,3,169,2015
Michael Kim,Sevran,Ile-de-France,4,"Dania Floating Shelf Set, Metal",15.2,152,47,1,5,164,2015,2,168,2015
Michael Kim,Sevran,Ile-de-France,4,"Fellowes Box, Blue",12.4,124,8,7,5,164,2015,2,168,2015
Ruby Nicholls,Huddinge,Stockholm,3,"Advantus Light Bulb, Black",43.2,72,-24,9,5,164,2015,1,167,2015
Ruby Nicholls,Huddinge,Stockholm,3,"Harbour Creations Color Coded Labels, 5000 Label Set",10.0,20,-1,3,5,164,2015,1,167,2015
Minnie Cash,Wolverhampton,England,7,"Harbour Creations Chairmat, Black",0.0,278,58,4,6,165,2015,6,172,2015
Minnie Cash,Wolverhampton,England,7,"Cameo Peel and Seal, with clear poly window",0.0,74,32,3,6,165,2015,6,172,2015
Minnie Cash,Wolverhampton,England,7,"Cisco Signal Booster, Full Size",0.0,153,5,1,6,165,2015,6,172,2015
Tia Metcalfe,Saint-Dizier,Alsace-Champagne-Ardenne-Lorraine,6,"Hamilton Beach Refrigerator, Black",89.9,899,80,2,6,165,2015,5,171,2015
Toby Patterson,Kettering,England,3,"Avery Index Tab, Durable",0.0,33,9,5,6,165,2015,2,168,2015
Toby Patterson,Kettering,England,3,"Fiskars Scissors, High Speed",0.0,116,56,5,6,165,2015,2,168,2015
Julian Mack,Bournemouth,England,6,"Sanford Pens, Easy-Erase",0.0,34,8,3,6,165,2015,5,171,2015
Robert Neil,Palma de Mallorca,Balearic Islands,3,"Binney & Smith Pens, Water Color",0.0,30,11,2,6,165,2015,2,168,2015
Robert Neil,Palma de Mallorca,Balearic Islands,3,"Avery Binder Covers, Clear",0.0,11,2,1,6,165,2015,2,168,2015
Dylan O'Halloran,Antwerp,Antwerp,2,"Green Bar Cards & Envelopes, 8.5 x 11",0.0,105,19,2,6,165,2015,1,167,2015
Thomas Shepherd,Lyon,Auvergne-Rhône-Alpes,1,"Rubbermaid Photo Frame, Erganomic",0.0,101,31,2,6,165,2015,0,166,2015
Jay Andrews,Madrid,Madrid,0,"Binney & Smith Highlighters, Fluorescent",0.0,36,3,2,6,165,2015,6,165,2015
Lorri Stratton,Tilburg,North Brabant,6,"Sauder Library with Doors, Metal",290.5,581,-198,3,6,165,2015,5,171,2015
Lorri Stratton,Tilburg,North Brabant,6,"Advantus Photo Frame, Durable",24.0,120,-6,3,6,165,2015,5,171,2015
Lorri Stratton,Tilburg,North Brabant,6,"Tenex Photo Frame, Duo Pack",49.8,249,84,6,6,165,2015,5,171,2015
Lorri Stratton,Tilburg,North Brabant,6,"BIC Canvas, Fluorescent",68.5,137,-41,5,6,165,2015,5,171,2015
Lorri Stratton,Tilburg,North Brabant,6,"Sanford Pens, Blue",5.5,11,-6,2,6,165,2015,5,171,2015
Lorri Stratton,Tilburg,North Brabant,6,"Cardinal Binder Covers, Economy",6.0,12,-11,2,6,165,2015,5,171,2015
Lorri Stratton,Tilburg,North Brabant,6,"Logitech Keyboard, Bluetooth",36.0,72,-58,2,6,165,2015,5,171,2015
Lisa Casey,Trier,Rhineland-Palatinate,4,"Cuisinart Coffee Grinder, White",16.5,165,57,5,6,165,2015,3,169,2015
Lisa Casey,Trier,Rhineland-Palatinate,4,"Wilson Jones Binding Machine, Recycled",0.0,49,5,1,6,165,2015,3,169,2015
Lisa Casey,Trier,Rhineland-Palatinate,4,"Stockwell Staples, Bulk Pack",0.0,31,13,3,6,165,2015,3,169,2015
Lisa Casey,Trier,Rhineland-Palatinate,4,"Kleencut Ruler, Serrated",0.0,41,10,4,6,165,2015,3,169,2015
Robert Zapata,Frankfurt,Hesse,7,"Binney & Smith Markers, Fluorescent",0.0,76,21,3,0,166,2015,0,173,2015
Robert Zapata,Frankfurt,Hesse,7,"Belkin Mouse, Erganomic",0.0,347,59,9,0,166,2015,0,173,2015
Cynthia Zielinski,Madrid,Madrid,7,"Acco Binder Covers, Durable",0.0,44,20,3,0,166,2015,0,173,2015
Cynthia Zielinski,Madrid,Madrid,7,"Wilson Jones 3-Hole Punch, Economy",0.0,84,28,3,0,166,2015,0,173,2015
Cynthia Zielinski,Madrid,Madrid,7,"Wilson Jones 3-Hole Punch, Economy",0.0,84,28,3,0,166,2015,0,173,2015
Cynthia Zielinski,Madrid,Madrid,7,"Enermax Router, Programmable",0.0,2079,852,8,0,166,2015,0,173,2015
Cynthia Zielinski,Madrid,Madrid,7,"Hewlett Wireless Fax, Laser",0.0,760,236,2,0,166,2015,0,173,2015
Ngoc Orozco,Trani,Apulia,4,"BIC Pencil Sharpener, Fluorescent",0.0,242,82,8,0,166,2015,4,170,2015
Sam French,Rennes,Brittany,6,"Office Star Rocking Chair, Adjustable",103.2,1032,298,8,0,166,2015,6,172,2015
Sam French,Rennes,Brittany,6,"Rubbermaid Photo Frame, Erganomic",0.0,151,47,3,0,166,2015,6,172,2015
Sam French,Rennes,Brittany,6,"Binney & Smith Sketch Pad, Blue",0.0,185,48,4,0,166,2015,6,172,2015
Casey Beckett,Velbert,North Rhine-Westphalia,7,"Tenex File Cart, Single Width",36.2,362,-4,3,0,166,2015,0,173,2015
Zara Money,Latina,Lazio,5,"Bush Stackable Bookrack, Traditional",0.0,369,92,3,1,167,2015,6,172,2015
Zara Money,Latina,Lazio,5,"Acco 3-Hole Punch, Recycled",0.0,213,19,7,1,167,2015,6,172,2015
Zara Money,Latina,Lazio,5,"Cameo Interoffice Envelope, Security-Tint",0.0,100,10,2,1,167,2015,6,172,2015
Kristina Moore,London,England,7,"Binney & Smith Sketch Pad, Water Color",17.8,178,45,4,1,167,2015,1,174,2015
Kristina Moore,London,England,7,"Epson Card Printer, Durable",107.1,1071,286,7,1,167,2015,1,174,2015
Kristina Moore,London,England,7,"Okidata Calculator, White",13.7,137,-12,3,1,167,2015,1,174,2015
Lily Tyler,Leeds,England,3,"Stanley Sketch Pad, Fluorescent",0.0,91,15,2,3,169,2015,6,172,2015
Lily Tyler,Leeds,England,3,"HP Fax Machine, Laser",0.0,1200,480,4,3,169,2015,6,172,2015
Mary Hough,Potsdam,Brandenburg,3,"Wilson Jones Index Tab, Economy",0.0,58,15,9,3,169,2015,6,172,2015
Mary Hough,Potsdam,Brandenburg,3,"Belkin Numeric Keypad, Erganomic",0.0,59,1,1,3,169,2015,6,172,2015
Mary Hough,Potsdam,Brandenburg,3,"Enermax Flash Drive, USB",0.0,334,130,8,3,169,2015,6,172,2015
Ethan Howarth,Vienna,Vienna,4,"Deflect-O Frame, Durable",0.0,428,176,4,3,169,2015,0,173,2015
Ethan Howarth,Vienna,Vienna,4,"Boston Pens, Easy-Erase",0.0,29,10,2,3,169,2015,0,173,2015
Ethan Howarth,Vienna,Vienna,4,"Ibico Binder, Durable",0.0,34,1,2,3,169,2015,0,173,2015
Ethan Howarth,Vienna,Vienna,4,"Eldon Trays, Blue",0.0,240,43,5,3,169,2015,0,173,2015
Ethan Howarth,Vienna,Vienna,4,"StarTech Phone, Wireless",0.0,298,24,4,3,169,2015,0,173,2015
Stella Balcombe,Bremen,Bremen,3,"Nokia Headset, with Caller ID",0.0,292,35,4,3,169,2015,6,172,2015
Alice Currie,Antony,Ile-de-France,2,"Novimex Executive Leather Armchair, Red",124.3,1243,345,3,3,169,2015,5,171,2015
Alice Currie,Antony,Ile-de-France,2,"Fellowes Box, Blue",5.3,53,3,3,3,169,2015,5,171,2015
Alice Currie,Antony,Ile-de-France,2,"Logitech Router, Programmable",0.0,1244,448,5,3,169,2015,5,171,2015
Everett Dunbar,Granada,Andalusía,4,"Fellowes Box, Single Width",5.3,53,-2,3,3,169,2015,0,173,2015
Everett Dunbar,Granada,Andalusía,4,"Sharp Personal Copier, Digital",0.0,598,299,5,3,169,2015,0,173,2015
Angus Reading,Cesena,Emilia-Romagna,4,"Advantus Rubber Bands, 12 Pack",0.0,48,13,3,4,170,2015,1,174,2015
Angus Fryar,Sarreguemines,Alsace-Champagne-Ardenne-Lorraine,5,"Bush 3-Shelf Cabinet, Mobile",26.3,263,15,2,4,170,2015,2,175,2015
Angus Fryar,Sarreguemines,Alsace-Champagne-Ardenne-Lorraine,5,"Stiletto Ruler, Steel",0.0,43,21,3,4,170,2015,2,175,2015
Jessie White,Bremen,Bremen,2,"Deflect-O Door Stop, Duo Pack",0.0,264,95,6,4,170,2015,6,172,2015
Jessie White,Bremen,Bremen,2,"Boston Sketch Pad, Fluorescent",0.0,150,0,3,4,170,2015,6,172,2015
Anthony Stewart,Girona,Catalonia,5,"Belkin Memory Card, Programmable",0.0,582,174,5,4,170,2015,2,175,2015
Jay Andrews,Milan,Lombardy,2,"Fellowes Box, Blue",18.8,47,-19,4,4,170,2015,6,172,2015
Ella Dwyer-Gray,Leeds,England,5,"Chromcraft Conference Table, with Bottom Storage",0.0,873,61,1,5,171,2015,3,176,2015
Ella Dwyer-Gray,Leeds,England,5,"Stanley Pens, Blue",0.0,40,20,4,5,171,2015,3,176,2015
Ella Dwyer-Gray,Leeds,England,5,"Cardinal Binder Covers, Economy",0.0,48,2,4,5,171,2015,3,176,2015
Jose Gambino,Toulouse,Languedoc-Roussillon-Midi-Pyrénées,3,"Canon Personal Copier, High-Speed",384.8,592,-643,12,5,171,2015,1,174,2015
Maya Pamphlett,Tivoli,Lazio,2,"Advantus Photo Frame, Duo Pack",0.0,159,60,3,5,171,2015,0,173,2015
Maya Pamphlett,Tivoli,Lazio,2,"Stockwell Staples, Assorted Sizes",0.0,25,11,3,5,171,2015,0,173,2015
Lauren Saunders,Rome,Lazio,3,"BIC Pens, Easy-Erase",0.0,102,22,7,6,172,2015,2,175,2015
Ricky Cullen,Dublin,Dublin,7,"Avery Binder, Clear",24.5,49,-40,8,6,172,2015,6,179,2015
Ricky Cullen,Dublin,Dublin,7,"Cardinal Index Tab, Clear",3.5,7,-2,2,6,172,2015,6,179,2015
Ricky Cullen,Dublin,Dublin,7,"Eaton Computer Printout Paper, Multicolor",7.0,14,-10,1,6,172,2015,6,179,2015
Audrey Emanuel,Letchworth,England,6,"Dania Floating Shelf Set, Metal",0.0,506,192,3,0,173,2015,6,179,2015
Audrey Emanuel,Letchworth,England,6,"Acco Index Tab, Clear",0.0,8,3,1,0,173,2015,6,179,2015
Audrey Emanuel,Letchworth,England,6,"Epson Receipt Printer, Red",0.0,228,114,2,0,173,2015,6,179,2015
Nicholas Carey,Bologna,Emilia-Romagna,4,"BIC Sketch Pad, Fluorescent",0.0,100,33,2,0,173,2015,4,177,2015
Nicholas Carey,Bologna,Emilia-Romagna,4,"Kleencut Box Cutter, Steel",0.0,136,22,4,0,173,2015,4,177,2015
Nicholas Carey,Bologna,Emilia-Romagna,4,"Nokia Headset, with Caller ID",52.8,132,-61,3,0,173,2015,4,177,2015
Henry Pedder,Edinburgh,Scotland,5,"Sauder Library with Doors, Pine",0.0,778,62,2,0,173,2015,5,178,2015
Henry Pedder,Edinburgh,Scotland,5,"Lesro Round Table, Rectangular",0.0,899,396,2,0,173,2015,5,178,2015
Henry Pedder,Edinburgh,Scotland,5,"Cardinal Index Tab, Clear",0.0,27,11,4,0,173,2015,5,178,2015
John Harris,Oslo,Oslo,4,"BIC Sketch Pad, Water Color",0.0,52,8,1,0,173,2015,4,177,2015
Jonathan Summons,Alphen aan den Rijn,South Holland,6,"Enermax Cards & Envelopes, 8.5 x 11",38.5,77,-63,3,0,173,2015,6,179,2015
Jonathan Summons,Alphen aan den Rijn,South Holland,6,"Elite Ruler, High Speed",38.0,76,-64,11,0,173,2015,6,179,2015
Charlie Brooks,Saint-Nazaire,Pays de la Loire,7,"Hewlett Ink, Color",57.45,383,-5,3,1,174,2015,1,181,2015
Skye McCaffrey,Berlin,Berlin,5,"SAFCO Swivel Stool, Adjustable",81.8,409,143,3,2,175,2015,0,180,2015
Skye McCaffrey,Berlin,Berlin,5,"Avery Hole Reinforcements, Durable",1.6,16,5,3,2,175,2015,0,180,2015
Alannah Langridge,London,England,3,"Fellowes Box, Wire Frame",5.1,51,20,3,2,175,2015,5,178,2015
Alannah Langridge,London,England,3,"Brother Fax and Copier, High-Speed",153.6,1536,171,9,2,175,2015,5,178,2015
Isabella Fowler,Alphen aan den Rijn,South Holland,5,"Smead Round Labels, Adjustable",2.5,5,-2,2,2,175,2015,0,180,2015
Isabella Fowler,Alphen aan den Rijn,South Holland,5,"Smead Trays, Single Width",24.5,49,-17,2,2,175,2015,0,180,2015
Isabella Fowler,Alphen aan den Rijn,South Holland,5,"HP Wireless Fax, High-Speed",448.0,896,-36,5,2,175,2015,0,180,2015
Darcy St George,Rome,Lazio,6,"Fellowes Trays, Single Width",27.6,69,11,2,3,176,2015,2,182,2015
Abby Mei,Lucerne,Lucerne,7,"Rubbermaid Clock, Duo Pack",0.0,251,40,5,3,176,2015,3,183,2015
Abby Mei,Lucerne,Lucerne,7,"Enermax Computer Printout Paper, Multicolor",0.0,149,4,5,3,176,2015,3,183,2015
Abby Mei,Lucerne,Lucerne,7,"Tenex File Cart, Single Width",0.0,269,126,2,3,176,2015,3,183,2015
Abby Mei,Lucerne,Lucerne,7,"Hewlett Wireless Fax, Laser",0.0,3422,1061,9,3,176,2015,3,183,2015
Bettie Lang,Cologne,North Rhine-Westphalia,6,"GlobeWeis Clasp Envelope, Recycled",0.0,26,7,3,3,176,2015,2,182,2015
Mike Langer,Blackpool,England,5,"Ibico Hole Reinforcements, Clear",0.0,6,2,1,3,176,2015,1,181,2015
Mike Langer,Blackpool,England,5,"Hon Shipping Labels, Alphabetical",0.0,22,10,2,3,176,2015,1,181,2015
Hershel Snyder,Rome,Lazio,5,"Fellowes Lockers, Industrial",249.2,623,41,5,4,177,2015,2,182,2015
Alpha Ross,Clichy-sous-Bois,Ile-de-France,4,"Advantus Frame, Erganomic",0.0,439,140,4,4,177,2015,1,181,2015
Alpha Ross,Clichy-sous-Bois,Ile-de-France,4,"Rubbermaid Photo Frame, Durable",0.0,146,7,3,4,177,2015,1,181,2015
Alpha Ross,Clichy-sous-Bois,Ile-de-France,4,"Avery Binder Covers, Economy",0.0,44,14,4,4,177,2015,1,181,2015
