Jodie Mellor,Pulheim,North Rhine-Westphalia,4,"Apple Signal Booster, with Caller ID",0.0,683,61,5,0,146,2014,4,150,2014
Lauren Saunders,Alicante,Valenciana,1,"Binney & Smith Sketch Pad, Blue",0.0,371,96,8,0,146,2014,1,147,2014
Lauren Saunders,Alicante,Valenciana,1,"SanDisk Cards & Envelopes, Recycled",0.0,97,4,2,0,146,2014,1,147,2014
Molly Palmer,Drancy,Ile-de-France,5,"Binney & Smith Pencil Sharpener, Water Color",0.0,209,48,7,1,147,2014,6,152,2014
Molly Palmer,Drancy,Ile-de-France,5,"Enermax Parchment Paper, 8.5 x 11",0.0,117,33,6,1,147,2014,6,152,2014
Molly Palmer,Drancy,Ile-de-France,5,"Tenex Box, Wire Frame",4.2,42,17,3,1,147,2014,6,152,2014
Zachary Disher,Barletta,Apulia,3,"Hewlett Wireless Fax, High-Speed",0.0,1514,742,4,3,149,2014,6,152,2014
Walter Coley,San Fernando,Andalusía,4,"Stanley Highlighters, Water Color",0.0,54,18,3,4,150,2014,1,154,2014
Walter Coley,San Fernando,Andalusía,4,"Avery Index Tab, Clear",0.0,25,1,4,4,150,2014,1,154,2014
Walter Coley,San Fernando,Andalusía,4,"Okidata Receipt Printer, Wireless",44.2,442,84,4,4,150,2014,1,154,2014
Harrison Cooke,Luton,England,0,"Nokia Smart Phone, Full Size",0.0,5725,2461,9,4,150,2014,4,150,2014
Harry Nelson,Schiedam,South Holland,2,"Stockwell Staples, 12 Pack",12.5,25,-6,5,5,151,2014,0,153,2014
Joan Douglas,Imola,Emilia-Romagna,2,"Acco Hole Reinforcements, Durable",0.0,65,30,8,6,152,2014,1,154,2014
Joan Douglas,Imola,Emilia-Romagna,2,"Novimex Round Labels, 5000 Label Set",0.0,13,6,2,6,152,2014,1,154,2014
Xavier Burford,Rotherham,England,6,"Logitech Numeric Keypad, Erganomic",0.0,44,18,1,6,152,2014,5,158,2014
Xavier Burford,Rotherham,England,6,"Samsung Smart Phone, VoIP",0.0,1909,57,3,6,152,2014,5,158,2014
Gregory Rodriguez,Herne,North Rhine-Westphalia,2,"Binney & Smith Markers, Easy-Erase",0.0,122,49,5,6,152,2014,1,154,2014
Gregory Rodriguez,Herne,North Rhine-Westphalia,2,"Eaton Message Books, Recycled",0.0,102,14,5,6,152,2014,1,154,2014
David To,Hanover,Lower Saxony,2,"Bevis Conference Table, Fully Assembled",471.75,555,-1925,4,6,152,2014,1,154,2014
Jeffrey Laird,Avignon,Provence-Alpes-Côte d'Azur,5,"Fiskars Scissors, Serrated",0.0,79,36,4,0,153,2014,5,158,2014
Jeffrey Laird,Avignon,Provence-Alpes-Côte d'Azur,5,"Konica Receipt Printer, Durable",46.8,312,51,3,0,153,2014,5,158,2014
Sophie Franklin,Brest,Brittany,6,"Sanford Canvas, Easy-Erase",0.0,102,13,2,0,153,2014,6,159,2014
Rhonda Ford,Dresden,Saxony,2,"Acco Index Tab, Economy",5.0,10,-1,2,0,153,2014,2,155,2014
Sarah Cross,Hamburg,Hamburg,5,"Ikea Library with Doors, Pine",197.0,1970,503,6,0,153,2014,5,158,2014
Sarah Cross,Hamburg,Hamburg,5,"Stanley Pens, Fluorescent",0.0,34,3,3,0,153,2014,5,158,2014
Daniel Howells,Plymouth,England,4,"Canon Wireless Fax, High-Speed",0.0,377,98,1,0,153,2014,4,157,2014
Sophie Franklin,Basel,Basel-Stadt,2,"Binney & Smith Pens, Water Color",0.0,45,16,3,0,153,2014,2,155,2014
Hollie Norris,Angers,Pays de la Loire,4,"Fellowes Box, Wire Frame",3.4,34,13,2,1,154,2014,5,158,2014
Bianca Whitford,Clamart,Ile-de-France,6,"Harbour Creations Chairmat, Set of Two",13.4,134,4,2,1,154,2014,0,160,2014
Bianca Whitford,Clamart,Ile-de-France,6,"Sanford Pens, Water Color",0.0,43,20,3,1,154,2014,0,160,2014
Zona Meyer,Oldenburg,Lower Saxony,4,"Advantus Paper Clips, Metal",0.0,54,13,4,1,154,2014,5,158,2014
Zona Meyer,Oldenburg,Lower Saxony,4,"Fellowes Folders, Industrial",2.4,24,3,1,1,154,2014,5,158,2014
Jason Roger,Grigny,Ile-de-France,4,"Ames Mailers, Security-Tint",0.0,230,21,6,3,156,2014,0,160,2014
Gerald Booth,Tours,Centre-Val de Loire,4,"Novimex Chairmat, Adjustable",26.5,265,82,5,3,156,2014,0,160,2014
Gerald Booth,Tours,Centre-Val de Loire,4,"Enermax Memo Slips, Premium",0.0,31,1,2,3,156,2014,0,160,2014
Lester Wimmer,Newcastle upon Tyne,England,4,"Avery Binding Machine, Recycled",0.0,98,42,2,3,156,2014,0,160,2014
Joan Douglas,Nancy,Alsace-Champagne-Ardenne-Lorraine,6,"Cameo Clasp Envelope, Security-Tint",0.0,36,9,3,4,157,2014,3,163,2014
Georgina Arnold,Bologna,Emilia-Romagna,5,"Advantus Light Bulb, Black",0.0,40,19,2,5,158,2014,3,163,2014
Aaron Davey,Palaiseau,Ile-de-France,4,"Advantus Frame, Durable",0.0,973,107,9,5,158,2014,2,162,2014
Aaron Davey,Palaiseau,Ile-de-France,4,"Acco Index Tab, Clear",0.0,16,7,2,5,158,2014,2,162,2014
Aaron Davey,Palaiseau,Ile-de-France,4,"Cameo Business Envelopes, Recycled",0.0,77,8,4,5,158,2014,2,162,2014
Ebony Northcott,Heidelberg,Baden-Württemberg,5,"Sanford Canvas, Blue",0.0,152,44,3,5,158,2014,3,163,2014
Alexandra Macdonald,Guyancourt,Ile-de-France,5,"Stockwell Staples, Assorted Sizes",0.0,58,25,7,5,158,2014,3,163,2014
Alexandra Macdonald,Guyancourt,Ile-de-France,5,"Novimex Legal Exhibit Labels, Laser Printer Compatible",0.0,21,7,2,5,158,2014,3,163,2014
Claudia Poore,Berlin,Berlin,5,"Harbour Creations Removable Labels, Adjustable",3.7,37,2,5,5,158,2014,3,163,2014
Aidan Hayward,Munich,Bavaria,1,"Apple Audio Dock, with Caller ID",0.0,501,75,3,6,159,2014,0,160,2014
Ruby Frost,West Bromwich,England,2,"Cameo Interoffice Envelope, Recycled",0.0,92,39,2,6,159,2014,1,161,2014
Ruby Frost,West Bromwich,England,2,"Smead Folders, Blue",0.0,35,4,2,6,159,2014,1,161,2014
Kian Pollard,Widnes,England,5,"Binney & Smith Markers, Easy-Erase",0.0,97,39,4,0,160,2014,5,165,2014
Kian Pollard,Widnes,England,5,"Binney & Smith Sketch Pad, Water Color",0.0,149,49,3,0,160,2014,5,165,2014
Kian Pollard,Widnes,England,5,"Boston Pens, Water Color",0.0,104,9,6,0,160,2014,5,165,2014
Kian Pollard,Widnes,England,5,"HP Fax Machine, High-Speed",0.0,1491,74,5,0,160,2014,5,165,2014
Max Ronald,Bonneuil-sur-Marne,Ile-de-France,5,"Tenex Trays, Single Width",14.6,146,46,3,0,160,2014,5,165,2014
Lewis Greenwood,Mont-Saint-Aignan,Normandy,5,"Boston Pens, Water Color",0.0,52,5,3,0,160,2014,5,165,2014
Makayla Elphinstone,Turin,Piedmont,4,"Rogers File Cart, Single Width",204.0,510,-119,6,0,160,2014,4,164,2014
Rose Heap,Madrid,Madrid,4,"Fiskars Letter Opener, High Speed",0.0,55,2,2,1,161,2014,5,165,2014
Mike Obrien,Uppsala,Uppsala,7,"Office Star Bag Chairs, Black",79.5,159,-29,6,1,161,2014,1,168,2014
Mike Obrien,Uppsala,Uppsala,7,"OIC Paper Clips, Assorted Sizes",6.0,12,-6,2,1,161,2014,1,168,2014
Mike Obrien,Uppsala,Uppsala,7,"Enermax Memo Slips, Recycled",4.0,8,-5,1,1,161,2014,1,168,2014
Mike Obrien,Uppsala,Uppsala,7,"Enermax Note Cards, Premium",30.0,60,-35,4,1,161,2014,1,168,2014
Mike Obrien,Uppsala,Uppsala,7,"Nokia Speaker Phone, Full Size",124.5,249,-149,4,1,161,2014,1,168,2014
Charles Carey,Lyon,Auvergne-Rhône-Alpes,4,"Safco Floating Shelf Set, Pine",35.7,357,20,2,3,163,2014,0,167,2014
Daniel Lucas,Marl,North Rhine-Westphalia,4,"Eldon Shelving, Blue",8.7,87,16,2,3,163,2014,0,167,2014
Corey Browne,Munich,Bavaria,4,"Stanley Pens, Water Color",0.0,53,17,4,3,163,2014,0,167,2014
Bryce Efird,Vienna,Vienna,4,"Binney & Smith Pens, Water Color",0.0,30,11,2,3,163,2014,0,167,2014
Bryce Efird,Vienna,Vienna,4,"Tenex File Cart, Industrial",0.0,402,76,3,3,163,2014,0,167,2014
Edward Dolling,Feira,Aveiro,4,"Samsung Signal Booster, with Caller ID",170.5,341,-341,5,3,163,2014,0,167,2014
Aidan Rowe,Rotterdam,South Holland,5,"Office Star Steel Folding Chair, Red",91.5,183,-140,4,3,163,2014,1,168,2014
Aidan Rowe,Rotterdam,South Holland,5,"Wilson Jones Binder, Recycled",23.5,47,-11,7,3,163,2014,1,168,2014
Robert Barnes,Blackburn,England,5,"Eldon Box, Single Width",0.0,21,6,2,3,163,2014,1,168,2014
Mark Briggs,Munster,Lower Saxony,4,"Eldon Lockers, Industrial",71.4,714,309,4,4,164,2014,1,168,2014
Mark Briggs,Munster,Lower Saxony,4,"Hewlett Fax Machine, Laser",0.0,320,16,1,4,164,2014,1,168,2014
Bryce Efird,Reggio nell'Emilia,Emilia-Romagna,4,"Novimex Bag Chairs, Set of Two",57.6,96,-87,5,4,164,2014,1,168,2014
Bryce Efird,Reggio nell'Emilia,Emilia-Romagna,4,"Eldon File Cart, Single Width",61.6,154,8,2,4,164,2014,1,168,2014
Bryce Efird,Reggio nell'Emilia,Emilia-Romagna,4,"Rogers Trays, Blue",14.8,37,-6,1,4,164,2014,1,168,2014
Alfonso Gomez,San Sebastian,Basque Country,2,"Stanley Pencil Sharpener, Water Color",0.0,84,3,3,5,165,2014,0,167,2014
Jade Daniels,Montpellier,Languedoc-Roussillon-Midi-Pyrénées,4,"Logitech Keyboard, Erganomic",0.0,492,44,7,5,165,2014,2,169,2014
Jade Daniels,Montpellier,Languedoc-Roussillon-Midi-Pyrénées,4,"Motorola Office Telephone, Full Size",55.95,373,74,6,5,165,2014,2,169,2014
Gary Crume,Bayonne,Aquitaine-Limousin-Poitou-Charentes,6,"Smead Box, Single Width",3.9,39,7,4,6,166,2014,5,172,2014
Samantha Reynell,Massy,Ile-de-France,5,"Ibico Binder Covers, Clear",0.0,92,6,7,6,166,2014,4,171,2014
Samantha Reynell,Massy,Ile-de-France,5,"Harbour Creations Round Labels, Alphabetical",0.0,59,23,9,6,166,2014,4,171,2014
Samantha Reynell,Massy,Ile-de-France,5,"Eldon Folders, Single Width",6.1,61,25,4,6,166,2014,4,171,2014
Samantha Reynell,Massy,Ile-de-France,5,"Smead Shelving, Wire Frame",13.0,130,52,3,6,166,2014,4,171,2014
Samantha Reynell,Massy,Ile-de-France,5,"Acme Box Cutter, High Speed",0.0,113,54,3,6,166,2014,4,171,2014
Samantha Reynell,Massy,Ile-de-France,5,"Logitech Numeric Keypad, Erganomic",0.0,397,163,9,6,166,2014,4,171,2014
Maddison Newman,Aprilia,Lazio,6,"Xerox Cards & Envelopes, Recycled",0.0,135,43,3,0,167,2014,6,173,2014
Maddison Newman,Aprilia,Lazio,6,"Fellowes Box, Wire Frame",22.4,56,6,5,0,167,2014,6,173,2014
Ryan Ackland,Paris,Ile-de-France,4,"Fellowes File Cart, Industrial",24.8,248,8,2,0,167,2014,4,171,2014
Scarlett Truchanas,Mont-de-Marsan,Aquitaine-Limousin-Poitou-Charentes,0,"Stanley Pencil Sharpener, Water Color",0.0,28,1,1,0,167,2014,0,167,2014
Scarlett Truchanas,Mont-de-Marsan,Aquitaine-Limousin-Poitou-Charentes,0,"Acco 3-Hole Punch, Economy",0.0,90,17,3,0,167,2014,0,167,2014
Scarlett Truchanas,Mont-de-Marsan,Aquitaine-Limousin-Poitou-Charentes,0,"Belkin Memory Card, Bluetooth",0.0,230,50,2,0,167,2014,0,167,2014
Scarlett Truchanas,Mont-de-Marsan,Aquitaine-Limousin-Poitou-Charentes,0,"Logitech Router, Erganomic",0.0,981,176,4,0,167,2014,0,167,2014
Viola Watson,Birmingham,England,4,"Office Star Bag Chairs, Black",13.5,27,-5,1,0,167,2014,4,171,2014
Viola Watson,Birmingham,England,4,"Acco Binder Covers, Durable",18.5,37,-4,5,0,167,2014,4,171,2014
Viola Watson,Birmingham,England,4,"Apple Headset, with Caller ID",36.5,73,-51,2,0,167,2014,4,171,2014
Nelson Olsen,Rotterdam,South Holland,6,"Boston Sketch Pad, Easy-Erase",24.5,49,-21,2,0,167,2014,6,173,2014
Nelson Olsen,Rotterdam,South Holland,6,"Memorex Numeric Keypad, USB",43.0,86,-29,4,0,167,2014,6,173,2014
Thomas Thompson,Brandenburg,Brandenburg,3,"Cameo Clasp Envelope, Security-Tint",0.0,36,9,3,1,168,2014,4,171,2014
Steven Cordoba,Remscheid,North Rhine-Westphalia,4,"Cardinal Hole Reinforcements, Clear",0.0,24,11,5,1,168,2014,5,172,2014
Ginger Owens,Velletri,Lazio,4,"Bush Library with Doors, Metal",0.0,2546,382,7,1,168,2014,5,172,2014
Ginger Owens,Velletri,Lazio,4,"Jiffy Business Envelopes, Security-Tint",0.0,48,3,3,1,168,2014,5,172,2014
Ginger Owens,Velletri,Lazio,4,"Fellowes Trays, Blue",55.2,138,-76,4,1,168,2014,5,172,2014
Ginger Owens,Velletri,Lazio,4,"Acme Scissors, Easy Grip",0.0,108,26,4,1,168,2014,5,172,2014
Ginger Owens,Velletri,Lazio,4,"Stiletto Ruler, Serrated",0.0,46,15,4,1,168,2014,5,172,2014
Libby McDonald,Bradford,England,3,"Deflect-O Stacking Tray, Durable",15.9,53,-19,3,3,170,2014,6,173,2014
Libby McDonald,Bradford,England,3,"Ames Interoffice Envelope, Security-Tint",0.0,95,47,2,3,170,2014,6,173,2014
Libby McDonald,Bradford,England,3,"HP Fax Machine, Laser",0.0,900,360,3,3,170,2014,6,173,2014
Libby McDonald,Bradford,England,3,"Motorola Signal Booster, VoIP",0.0,716,36,5,3,170,2014,6,173,2014
Sharon Kerley,Wolverhampton,England,7,"Hon Steel Folding Chair, Set of Two",0.0,586,123,7,3,170,2014,3,177,2014
Sharon Kerley,Wolverhampton,England,7,"Sanford Markers, Water Color",0.0,79,7,3,3,170,2014,3,177,2014
Sharon Kerley,Wolverhampton,England,7,"Cameo Clasp Envelope, Security-Tint",0.0,36,9,3,3,170,2014,3,177,2014
Jose Gullo,Frankfurt,Hesse,6,"Fellowes Trays, Wire Frame",15.2,152,25,3,3,170,2014,2,176,2014
Jose Gullo,Frankfurt,Hesse,6,"Hewlett Copy Machine, Color",0.0,530,180,2,3,170,2014,2,176,2014
Jose Gullo,Frankfurt,Hesse,6,"Sharp Copy Machine, Laser",0.0,717,93,3,3,170,2014,2,176,2014
Jose Gullo,Frankfurt,Hesse,6,"Motorola Office Telephone, Full Size",0.0,365,117,5,3,170,2014,2,176,2014
William Horton,Lens,Nord-Pas-de-Calais-Picardie,2,"Hon Rocking Chair, Adjustable",12.0,120,51,1,3,170,2014,5,172,2014
William Horton,Lens,Nord-Pas-de-Calais-Picardie,2,"Barricks Conference Table, Adjustable Height",827.4,2364,-218,4,3,170,2014,5,172,2014
William Horton,Lens,Nord-Pas-de-Calais-Picardie,2,"Novimex Shipping Labels, Alphabetical",0.0,43,22,4,3,170,2014,5,172,2014
Angus De Groot,Duisburg,North Rhine-Westphalia,4,"Deflect-O Clock, Durable",0.0,142,45,3,4,171,2014,1,175,2014
Angus De Groot,Duisburg,North Rhine-Westphalia,4,"Eldon Door Stop, Duo Pack",0.0,151,47,3,4,171,2014,1,175,2014
Angus De Groot,Duisburg,North Rhine-Westphalia,4,"Ibico Hole Reinforcements, Clear",0.0,13,5,2,4,171,2014,1,175,2014
Angus De Groot,Duisburg,North Rhine-Westphalia,4,"Tenex Shelving, Single Width",4.9,49,8,1,4,171,2014,1,175,2014
Angus De Groot,Duisburg,North Rhine-Westphalia,4,"Kleencut Scissors, Steel",0.0,43,3,2,4,171,2014,1,175,2014
Holly Noble,Le Bouscat,Aquitaine-Limousin-Poitou-Charentes,0,"Hamilton Beach Stove, Silver",244.4,2444,760,5,4,171,2014,4,171,2014
Holly Noble,Le Bouscat,Aquitaine-Limousin-Poitou-Charentes,0,"Binney & Smith Pens, Easy-Erase",0.0,12,0,1,4,171,2014,4,171,2014
Holly Noble,Le Bouscat,Aquitaine-Limousin-Poitou-Charentes,0,"Hon Color Coded Labels, Alphabetical",0.0,25,0,2,4,171,2014,4,171,2014
Holly Noble,Le Bouscat,Aquitaine-Limousin-Poitou-Charentes,0,"Rogers Folders, Blue",13.8,138,-12,5,4,171,2014,4,171,2014
Holly Noble,Le Bouscat,Aquitaine-Limousin-Poitou-Charentes,0,"Samsung Smart Phone, Full Size",325.05,2167,790,4,4,171,2014,4,171,2014
Rachel Goddard,Vienna,Vienna,5,"Novimex File Folder Labels, Alphabetical",0.0,24,3,3,4,171,2014,2,176,2014
Rachel Goddard,Vienna,Vienna,5,"Motorola Headset, Cordless",0.0,248,79,3,4,171,2014,2,176,2014
Riley Howells,Antwerp,Antwerp,2,"Wilson Jones 3-Hole Punch, Recycled",0.0,198,59,7,4,171,2014,6,173,2014
Dominic Jordan,Hamburg,Hamburg,7,"Harbour Creations Executive Leather Armchair, Adjustable",257.1,2571,857,6,4,171,2014,4,178,2014
Mason Adams,Aubervilliers,Ile-de-France,4,"Acco Hole Reinforcements, Recycled",0.0,21,11,3,5,172,2014,2,176,2014
John Town,Nantes,Pays de la Loire,4,"Cardinal Binder Covers, Clear",0.0,34,9,3,5,172,2014,2,176,2014
John Town,Nantes,Pays de la Loire,4,"Nokia Smart Phone, Full Size",162.15,1081,356,2,5,172,2014,2,176,2014
Gail Thompson,Fuengirola,Andalusía,5,"Stanley Highlighters, Fluorescent",0.0,96,35,6,5,172,2014,3,177,2014
Aidan Hayward,Arras,Nord-Pas-de-Calais-Picardie,2,"Dania Classic Bookcase, Metal",258.4,2584,660,7,5,172,2014,0,174,2014
Laura Akhtar,El Escorial,Madrid,5,"Hoover Toaster, White",0.0,164,57,2,5,172,2014,3,177,2014
Kyle Beard,Jerez de la Frontera,Andalusía,5,"Safco Stackable Bookrack, Traditional",0.0,297,47,2,5,172,2014,3,177,2014
Julie Ochoa,Alphen aan den Rijn,South Holland,4,"Advantus Paper Clips, Bulk Pack",7.0,14,-10,2,5,172,2014,2,176,2014
Joel Ortega,Vienna,Vienna,7,"Fiskars Shears, Steel",0.0,94,27,2,6,173,2014,6,180,2014
Amy Pritchard,Kingswood,England,4,"Dania Corner Shelving, Traditional",0.0,610,207,5,6,173,2014,3,177,2014
Amy Pritchard,Kingswood,England,4,"Sharp Personal Copier, Laser",0.0,120,7,1,6,173,2014,3,177,2014
Lilian Macredie,Herne,North Rhine-Westphalia,7,"Cardinal 3-Hole Punch, Economy",0.0,144,65,5,6,173,2014,6,180,2014
Lilian Macredie,Herne,North Rhine-Westphalia,7,"Kraft Interoffice Envelope, Security-Tint",0.0,99,10,2,6,173,2014,6,180,2014
Jonathan Franklin,Torrevieja,Valenciana,4,"Stiletto Box Cutter, Steel",0.0,212,15,6,6,173,2014,3,177,2014
Leah Derham,Pessac,Aquitaine-Limousin-Poitou-Charentes,4,"Harbour Creations Shipping Labels, 5000 Label Set",0.0,24,5,2,6,173,2014,3,177,2014
Leah Derham,Pessac,Aquitaine-Limousin-Poitou-Charentes,4,"Tenex Shelving, Single Width",4.9,49,8,1,6,173,2014,3,177,2014
Ethan Howarth,Duisburg,North Rhine-Westphalia,7,"Elite Letter Opener, Easy Grip",0.0,145,7,5,0,174,2014,0,181,2014
Lilly Le Grand,Villefontaine,Auvergne-Rhône-Alpes,4,"Ikea Floating Shelf Set, Mobile",46.7,467,-26,3,0,174,2014,4,178,2014
Lilly Le Grand,Villefontaine,Auvergne-Rhône-Alpes,4,"HP Ink, High-Speed",64.65,431,-46,4,0,174,2014,4,178,2014
Lilly Le Grand,Villefontaine,Auvergne-Rhône-Alpes,4,"StarTech Printer, Red",96.9,646,213,3,0,174,2014,4,178,2014
Norma McCowan,Bottrop,North Rhine-Westphalia,2,"Avery Binding Machine, Clear",0.0,48,6,1,0,174,2014,2,176,2014
Norma McCowan,Bottrop,North Rhine-Westphalia,2,"Smead Trays, Single Width",13.1,131,32,3,0,174,2014,2,176,2014
Dylan Dry,Watford,England,5,"Cardinal 3-Hole Punch, Clear",0.0,85,18,3,1,175,2014,6,180,2014
Leticia Sorrells,Boulogne-Billancourt,Ile-de-France,3,"Safco Library with Doors, Mobile",176.5,1765,-98,5,1,175,2014,4,178,2014
Leticia Sorrells,Boulogne-Billancourt,Ile-de-France,3,"KitchenAid Coffee Grinder, Red",19.0,190,15,3,1,175,2014,4,178,2014
Michael Watkins,Pesaro,Marche,6,"Stanley Pencil Sharpener, Water Color",0.0,112,4,4,3,177,2014,2,183,2014
Michael Watkins,Pesaro,Marche,6,"Acco Binder, Recycled",0.0,124,4,8,3,177,2014,2,183,2014
Michael Watkins,Pesaro,Marche,6,"Ames Peel and Seal, with clear poly window",0.0,89,41,4,3,177,2014,2,183,2014
Michael Watkins,Pesaro,Marche,6,"Advantus Rubber Bands, Bulk Pack",0.0,17,5,1,3,177,2014,2,183,2014
Michael Watkins,Pesaro,Marche,6,"Eldon Folders, Single Width",12.4,31,4,3,3,177,2014,2,183,2014
Alfonso Gomez,London,England,6,"Sanford Pens, Fluorescent",2.2,22,4,2,3,177,2014,2,183,2014
Alfonso Gomez,London,England,6,"Acco Binder, Clear",3.9,39,10,3,3,177,2014,2,183,2014
Kiera Chandler,Wolverhampton,England,7,"Hon Bag Chairs, Adjustable",0.0,333,73,7,3,177,2014,3,184,2014
Kiera Chandler,Wolverhampton,England,7,"Okidata Inkjet, Wireless",0.0,2199,923,7,3,177,2014,3,184,2014
Freya Daniels,Esbjerg,South Denmark,4,"Sharp Ink, Color",94.5,189,-11,3,3,177,2014,0,181,2014
Liam Mathias,London,England,4,"Eldon File Cart, Single Width",34.5,345,31,3,3,177,2014,0,181,2014
Ethan Barrett,Taunton,England,6,"Avery Index Tab, Economy",0.0,39,16,5,3,177,2014,2,183,2014
Faith Chambers,Edinburgh,Scotland,2,"Advantus Door Stop, Duo Pack",47.4,158,-54,5,3,177,2014,5,179,2014
Jayden Ali,Villiers-le-Bel,Ile-de-France,0,"Stanley Markers, Easy-Erase",0.0,22,0,1,4,178,2014,4,178,2014
Jayden Ali,Villiers-le-Bel,Ile-de-France,0,"Smead Legal Exhibit Labels, Adjustable",0.0,27,4,3,4,178,2014,4,178,2014
Laura Akhtar,Ennigerloh,North Rhine-Westphalia,0,"Smead Box, Wire Frame",1.8,18,1,2,4,178,2014,4,178,2014
Laura Akhtar,Ennigerloh,North Rhine-Westphalia,0,"Apple Speaker Phone, Full Size",0.0,125,54,1,4,178,2014,4,178,2014
Everett Dunbar,Bremen,Bremen,5,"Hon Chairmat, Red",15.0,150,7,3,4,178,2014,2,183,2014
Everett Dunbar,Bremen,Bremen,5,"Okidata Inkjet, White",0.0,623,81,2,4,178,2014,2,183,2014
Mary Hough,Aulnay-sous-Bois,Ile-de-France,6,"Wilson Jones Index Tab, Economy",0.0,26,7,4,5,179,2014,4,185,2014
Mary Hough,Aulnay-sous-Bois,Ile-de-France,6,"Fellowes File Cart, Blue",24.7,247,82,2,5,179,2014,4,185,2014
Mary Hough,Aulnay-sous-Bois,Ile-de-France,6,"Brother Copy Machine, Color",100.95,673,222,3,5,179,2014,4,185,2014
Harriet Chadwick,Maisons-Alfort,Ile-de-France,6,"Smead Shelving, Single Width",8.8,88,34,2,5,179,2014,4,185,2014
Harriet Chadwick,Maisons-Alfort,Ile-de-France,6,"Konica Phone, Red",21.3,142,45,2,5,179,2014,4,185,2014
Eleanor Pollard,Schiedam,South Holland,7,"Sanford Pencil Sharpener, Water Color",7.5,15,-11,1,5,179,2014,5,186,2014
Mike Langer,Woking,England,6,"Wilson Jones 3-Hole Punch, Clear",0.0,82,23,3,6,180,2014,5,186,2014
Chloe Landale,London,England,5,"Hon Executive Leather Armchair, Black",82.3,823,247,2,6,180,2014,4,185,2014
Chloe Landale,London,England,5,"Fiskars Scissors, Steel",28.4,284,123,14,6,180,2014,4,185,2014
Bailey Morris,Munich,Bavaria,0,"Nokia Office Telephone, VoIP",0.0,196,72,3,6,180,2014,6,180,2014
Piper Wilder-Neligan,Emmen,Drenthe,7,"Sanford Pencil Sharpener, Water Color",19.5,39,-19,3,6,180,2014,6,187,2014
Nathan Allwood,London,England,5,"Fellowes Lockers, Single Width",56.0,560,44,3,0,181,2014,5,186,2014
Toby Rowley,Granada,Andalusía,4,"Kraft Business Envelopes, Set of 50",0.0,60,29,3,0,181,2014,4,185,2014
Toby Rowley,Granada,Andalusía,4,"Motorola Headset, Cordless",44.6,446,109,6,0,181,2014,4,185,2014
Minnie Cash,Gronau,North Rhine-Westphalia,2,"Stockwell Paper Clips, Bulk Pack",0.0,41,20,3,0,181,2014,2,183,2014
Minnie Cash,Gronau,North Rhine-Westphalia,2,"SanDisk Memory Card, Bluetooth",0.0,225,29,2,0,181,2014,2,183,2014
Sienna Williamson,Espoo,Uusimaa,4,"Novimex Chairmat, Set of Two",0.0,293,47,5,0,181,2014,4,185,2014
Sienna Williamson,Espoo,Uusimaa,4,"Stanley Canvas, Easy-Erase",0.0,99,24,2,0,181,2014,4,185,2014
Sienna Williamson,Espoo,Uusimaa,4,"Motorola Office Telephone, VoIP",0.0,216,95,3,0,181,2014,4,185,2014
Alex Greenwood,Berlin,Berlin,5,"SAFCO Rocking Chair, Adjustable",153.8,769,154,7,0,181,2014,5,186,2014
Alex Greenwood,Berlin,Berlin,5,"Eldon Clock, Duo Pack",15.3,153,58,3,0,181,2014,5,186,2014
Alex Greenwood,Berlin,Berlin,5,"Sanford Pens, Water Color",6.4,64,26,5,0,181,2014,5,186,2014
Alex Greenwood,Berlin,Berlin,5,"Avery Index Tab, Clear",1.6,16,3,3,0,181,2014,5,186,2014
Alex Greenwood,Berlin,Berlin,5,"Ibico Index Tab, Clear",5.6,56,5,7,0,181,2014,5,186,2014
Alex Greenwood,Berlin,Berlin,5,"Smead Folders, Wire Frame",10.6,53,-9,4,0,181,2014,5,186,2014
Alex Greenwood,Berlin,Berlin,5,"Brother Fax and Copier, Digital",34.4,344,15,2,0,181,2014,5,186,2014
Kristen Holland,Solna,Stockholm,5,"Hon Round Labels, Laser Printer Compatible",1.5,3,-1,1,0,181,2014,5,186,2014
Kian Sykes,Pomezia,Lazio,4,"Ibico 3-Hole Punch, Economy",0.0,91,46,3,1,182,2014,5,186,2014
Kian Sykes,Pomezia,Lazio,4,"OIC Thumb Tacks, Assorted Sizes",0.0,35,14,3,1,182,2014,5,186,2014
Kian Sykes,Pomezia,Lazio,4,"Hon Shipping Labels, 5000 Label Set",0.0,24,11,2,1,182,2014,5,186,2014
Kian Sykes,Pomezia,Lazio,4,"Tenex File Cart, Single Width",96.4,241,-125,3,1,182,2014,5,186,2014
Richard Poole,Madrid,Madrid,0,"Hon Rocking Chair, Red",104.4,522,-78,5,1,182,2014,1,182,2014
Tricia Bustamante,Edinburgh,Scotland,5,"Ikea 3-Shelf Cabinet, Traditional",0.0,712,320,5,2,183,2014,0,188,2014
Tricia Bustamante,Edinburgh,Scotland,5,"Bevis Wood Table, Rectangular",0.0,1062,181,2,2,183,2014,0,188,2014
Tricia Bustamante,Edinburgh,Scotland,5,"Binney & Smith Canvas, Fluorescent",0.0,158,30,3,2,183,2014,0,188,2014
Tricia Bustamante,Edinburgh,Scotland,5,"SanDisk Mouse, Bluetooth",0.0,230,25,6,2,183,2014,0,188,2014
Tricia Bustamante,Edinburgh,Scotland,5,"Nokia Headset, Cordless",0.0,380,84,5,2,183,2014,0,188,2014
Mackenzie Whitford,Offenbach,Hesse,6,"Binney & Smith Pencil Sharpener, Water Color",0.0,269,62,9,3,184,2014,2,190,2014
Tom Charlton,Torrevieja,Valenciana,4,"Acco Binder, Economy",0.0,30,4,2,4,185,2014,1,189,2014
Donna Nash,Montpellier,Languedoc-Roussillon-Midi-Pyrénées,4,"Panasonic Inkjet, Durable",318.45,2123,125,8,4,185,2014,1,189,2014
Georgina Fuller,Creil,Nord-Pas-de-Calais-Picardie,3,"Dania 3-Shelf Cabinet, Mobile",90.7,907,-30,7,4,185,2014,0,188,2014
Philip Newsom,Berlin,Berlin,5,"Ames Peel and Seal, Security-Tint",5.7,57,13,3,5,186,2014,3,191,2014
Philip Newsom,Berlin,Berlin,5,"Stockwell Clamps, Assorted Sizes",2.9,29,8,2,5,186,2014,3,191,2014
Ryan Price,Ghent,East Flanders,2,"Advantus Rubber Bands, Bulk Pack",0.0,66,22,4,5,186,2014,0,188,2014
Ryan Price,Ghent,East Flanders,2,"Smead Shelving, Blue",0.0,147,44,3,5,186,2014,0,188,2014
Eve Bates,Birkenhead,England,6,"Cuisinart Refrigerator, Red",0.0,1488,372,3,5,186,2014,4,192,2014
Eve Bates,Birkenhead,England,6,"Cameo Clasp Envelope, Security-Tint",0.0,24,6,2,5,186,2014,4,192,2014
Eve Bates,Birkenhead,England,6,"Tenex Box, Blue",0.0,99,25,6,5,186,2014,4,192,2014
Daniel Burke,London,England,6,"BIC Pencil Sharpener, Fluorescent",2.7,27,7,1,5,186,2014,4,192,2014
Daniel Burke,London,England,6,"GlobeWeis Peel and Seal, with clear poly window",4.5,45,-3,2,5,186,2014,4,192,2014
Daniel Burke,London,England,6,"Xerox Message Books, Premium",5.5,55,22,3,5,186,2014,4,192,2014
Anna Macdonald,Paderborn,North Rhine-Westphalia,3,"Sanford Markers, Easy-Erase",0.0,165,3,7,6,187,2014,2,190,2014
Anna Macdonald,Paderborn,North Rhine-Westphalia,3,"Stanley Sketch Pad, Fluorescent",0.0,46,7,1,6,187,2014,2,190,2014
Anna Macdonald,Paderborn,North Rhine-Westphalia,3,"Memorex Memory Card, Programmable",0.0,519,73,5,6,187,2014,2,190,2014
Rose Heap,Essen,North Rhine-Westphalia,6,"Tenex Trays, Single Width",9.8,98,30,2,6,187,2014,5,193,2014
Molly Palmer,Valenciennes,Nord-Pas-de-Calais-Picardie,4,"Hamilton Beach Stove, Red",195.2,1952,759,4,0,188,2014,4,192,2014
Bianca Whitford,Sunderland,England,6,"Acco Binder, Durable",0.0,33,9,2,0,188,2014,6,194,2014
Minnie Cash,Aix-en-Provence,Provence-Alpes-Côte d'Azur,4,"Harbour Creations Steel Folding Chair, Red",35.2,352,67,4,0,188,2014,4,192,2014
Minnie Cash,Aix-en-Provence,Provence-Alpes-Côte d'Azur,4,"Wilson Jones Binder Covers, Recycled",0.0,35,8,3,0,188,2014,4,192,2014
Minnie Cash,Aix-en-Provence,Provence-Alpes-Côte d'Azur,4,"OIC Push Pins, Bulk Pack",0.0,15,3,1,0,188,2014,4,192,2014
Minnie Cash,Aix-en-Provence,Provence-Alpes-Côte d'Azur,4,"Avery Legal Exhibit Labels, Laser Printer Compatible",0.0,23,3,2,0,188,2014,4,192,2014
Nathan Allwood,Frontignan,Languedoc-Roussillon-Midi-Pyrénées,7,"Office Star Rocking Chair, Adjustable",25.8,258,75,2,0,188,2014,0,195,2014
Nathan Allwood,Frontignan,Languedoc-Roussillon-Midi-Pyrénées,7,"Eldon Clock, Duo Pack",0.0,226,99,4,0,188,2014,0,195,2014
